<?xml version="1.0" encoding="UTF-8"?>
<Produits xmlns:xsi="http://www.w3.org/2001/XMLSchema-instance"
	  xsi:noNamespaceSchemaLocation="produits.xsd">
  <Produit ID="3-5670-C">
    <lib>Dady Mam - biberon</lib>
    <Quantity>91</Quantity>
    <Price Devises="EUR">7.90</Price>
    <Date>2008-12-03</Date>
  </Produit>
  <Produit ID="7-9997-B">
    <lib>Mc Traveler - Poussette</lib>
    <Quantity>57</Quantity>
    <Price Devises="JPY">22000</Price>
    <Date>2007-12-22</Date>
  </Produit>
  <Produit ID="2-3478-A">
    <lib>BB trop confort - Table a langer</lib>
    <Quantity>27</Quantity>
    <Price Devises="USD">75</Price>
    <Date>2009-06-01</Date>
  </Produit>
  <Produit ID="5-6767-A">
    <lib>BB Naturel - Set bain</lib>
    <Quantity>28</Quantity>
    <Price Devises="GBP">12</Price>
    <Date>2010-01-02</Date>
  </Produit>
  <Produit ID="5-6867-A">
    <lib>BB Naturel - set 3 bodies</lib>
    <Quantity>23</Quantity>
    <Price Devises="EUR">12</Price>
    <Date>2010-01-02</Date>
  </Produit>
</Produits>